{
  "schema_version": 2,
  "mode": "interactive",
  "autonomous_scheduler_allowed": false,
  "fallback_after_presence_expiry": true,
  "set_by": "ecosystem-supervisor",
  "authority": "Owner interactive-first execution directive, 2026-09-23",
  "reason": "Owner-facing live runtime is carrying ACP item 19.5 remediation/retest. GitHub holds durable handoff; scheduler fallback is blocked while this presence lease is fresh.",
  "set_at": "2026-09-23T21:16:00Z",
  "presence": {
    "carrier_id": "owner-live-runtime-acp-19.5-2026-09-23",
    "heartbeat_at": "2026-09-23T21:16:00Z",
    "lease_until": "2026-09-23T22:16:00Z"
  },
  "owner_hold": {
    "enabled": false,
    "reason": null,
    "set_by": null,
    "set_at": null
  }
}
